{
  "$schema": "http://json-schema.org/draft-07/schema#",
  "$id": "https://studymaf.com/data/lesson.schema.json",
  "title": "StudyMAF Lesson",
  "description": "Source-of-truth schema for a StudyMAF lesson. The code owns this structure; the AI fills in data. Lessons are JSON only, never inline HTML.",
  "type": "object",
  "additionalProperties": false,
  "required": ["title", "summary", "concept_sections", "real_world_examples", "videos", "problems"],
  "properties": {
    "title": {
      "type": "string",
      "minLength": 1
    },
    "summary": {
      "type": "string",
      "minLength": 1
    },
    "figures": {
      "type": "array",
      "description": "Optional lesson-level diagrams (same shape as a concept/example figure).",
      "items": { "$ref": "#/$defs/figure" }
    },
    "glossary": {
      "type": "object",
      "description": "Keyword definitions. Any key that appears in concept/example text is auto-outlined and clickable. Each entry gives a first-time-reader plain explanation AND how the term is used in this class.",
      "additionalProperties": {
        "type": "object",
        "additionalProperties": false,
        "required": ["plain", "in_class"],
        "properties": {
          "plain": { "type": "string", "minLength": 1 },
          "in_class": { "type": "string", "minLength": 1 }
        }
      }
    },
    "concept_sections": {
      "type": "array",
      "description": "Ordered simple-to-complex progression. Level 1 is the simplest, grounded starting point; complexity grows as level increases. Every section should carry a figure.",
      "minItems": 1,
      "items": {
        "type": "object",
        "additionalProperties": false,
        "required": ["level", "heading", "explanation"],
        "properties": {
          "level": { "type": "integer", "minimum": 1 },
          "heading": { "type": "string", "minLength": 1 },
          "explanation": { "type": "string", "minLength": 1 },
          "math_steps": {
            "type": "array",
            "description": "Optional step-by-step walkthrough tying this level to the math, so the reader feels like a lesson. Each item is one short step (LaTeX in $...$ allowed).",
            "items": { "type": "string", "minLength": 1 }
          },
          "figure": { "$ref": "#/$defs/figure" }
        }
      }
    },
    "real_world_examples": {
      "type": "array",
      "description": "Exactly 3 grounded examples. Each card is collapsible and should carry a deeper 'detail' explanation and a figure.",
      "minItems": 3,
      "maxItems": 3,
      "items": {
        "type": "object",
        "additionalProperties": false,
        "required": ["title", "scenario", "how_the_math_applies"],
        "properties": {
          "title": { "type": "string", "minLength": 1 },
          "scenario": { "type": "string", "minLength": 1 },
          "how_the_math_applies": { "type": "string", "minLength": 1 },
          "detail": { "type": "string", "minLength": 1 },
          "figure": { "$ref": "#/$defs/figure" }
        }
      }
    },
    "videos": {
      "type": "object",
      "description": "YouTube SEARCH QUERIES, not URLs. Real links are pasted by hand in a later stage. Never fabricate links.",
      "additionalProperties": false,
      "required": ["concept_query", "math_query", "combined_query"],
      "properties": {
        "concept_query": { "type": "string", "minLength": 1 },
        "math_query": { "type": "string", "minLength": 1 },
        "combined_query": { "type": "string", "minLength": 1 }
      }
    },
    "problems": {
      "type": "array",
      "description": "Target 20 problems per lesson (spread roughly 6 easy / 8 medium / 4 hard / 2 stretch). A minimum of 8 is accepted so a full multi-lesson course can be authored and expanded over time. None should exceed the class's level.",
      "minItems": 8,
      "maxItems": 20,
      "items": {
        "type": "object",
        "additionalProperties": false,
        "required": ["id", "difficulty", "prompt", "correct_answer", "solution_steps", "hint"],
        "properties": {
          "id": { "type": "string", "minLength": 1 },
          "difficulty": { "type": "string", "enum": ["easy", "medium", "hard", "stretch"] },
          "prompt": { "type": "string", "minLength": 1 },
          "correct_answer": { "type": "string", "minLength": 1 },
          "solution_steps": {
            "type": "array",
            "minItems": 1,
            "items": { "type": "string", "minLength": 1 }
          },
          "hint": { "type": "string", "minLength": 1 }
        }
      }
    }
  },
  "$defs": {
    "figure": {
      "type": "object",
      "additionalProperties": false,
      "required": ["type"],
      "description": "A diagram rendered by the code in a consistent house style; data supplies only parameters. Types: 'schematic' (params.viewBox[w,h] + params.elements[] of primitives: charge {x,y,sign,label,r}, vector/arrow {x1,y1,x2,y2,label,color}, line {x1,y1,x2,y2,color,dash}, circle {x,y,r,dash,label,color}, plate {x,y,w,h,charge}, point {x,y,label,color}, label {x,y,text,color,size}, lens {x,y,h,kind}, ray same as vector); 'coordinate-plane'; 'number-line'.",
      "properties": {
        "type": { "type": "string", "enum": ["schematic", "coordinate-plane", "number-line"] },
        "caption": { "type": "string" },
        "params": { "type": "object" }
      }
    }
  }
}
