{
  "title": "Gauss's Law",
  "summary": "Electric flux measures how much field passes through a surface, $\\Phi = EA\\cos\\theta$. Gauss's law says the net flux through any closed surface equals the enclosed charge over $\\varepsilon_0$: $\\Phi = \\dfrac{Q_{enc}}{\\varepsilon_0}$. With enough symmetry this gives the field quickly. (University Physics Vol. 2, Ch. 6.)",
  "concept_sections": [
    { "level": 1, "heading": "Electric flux", "explanation": "Flux is field times the area it passes through, counting only the perpendicular part: $\\Phi = EA\\cos\\theta$, where $\\theta$ is the angle between $\\vec{E}$ and the surface's normal. When the field is perpendicular to the surface, $\\Phi = EA$; when parallel, $\\Phi = 0$. Units are N·m$^2$/C." },
    { "level": 2, "heading": "Gauss's law", "explanation": "For any closed surface, the total flux out equals the charge enclosed divided by $\\varepsilon_0 = 8.85\\times10^{-12}$ F/m: $\\Phi = \\dfrac{Q_{enc}}{\\varepsilon_0}$. Charges outside the surface contribute zero net flux — their field lines enter and leave. Only enclosed charge counts." },
    { "level": 3, "heading": "Using symmetry", "explanation": "Gauss's law is most powerful when the field is constant over a chosen 'Gaussian surface.' Use a sphere for point/spherical charge, a cylinder for a line/wire, and a pillbox for a plane. Then $E$ comes out of the flux integral and you solve $E\\,A = Q_{enc}/\\varepsilon_0$ for $E$." },
    { "level": 4, "heading": "Conductors", "explanation": "In electrostatic equilibrium the field inside a conductor is zero, so any net charge sits on its surface. A Gaussian surface just inside the conductor encloses no net charge. This is why a hollow conductor shields its interior — the basis of the Faraday cage." },
    { "level": 5, "heading": "Standard results", "explanation": "Gauss's law gives clean formulas: infinite sheet of charge $E = \\dfrac{\\sigma}{2\\varepsilon_0}$; just outside a conductor $E = \\dfrac{\\sigma}{\\varepsilon_0}$; infinite line of charge $E = \\dfrac{\\lambda}{2\\pi\\varepsilon_0 r} = \\dfrac{2k\\lambda}{r}$; outside a spherical charge the field is the same as a point charge at the center." }
  ],
  "real_world_examples": [
    { "title": "Safe inside a car during lightning", "scenario": "A car struck by lightning protects the people inside.", "how_the_math_applies": "The metal shell is a conductor, so by Gauss's law the field (and enclosed charge) inside is zero — a Faraday cage. Charge stays on the outer surface." },
    { "title": "Coaxial cable shielding", "scenario": "TV/antenna cables have a braided outer conductor.", "how_the_math_applies": "A cylindrical Gaussian surface shows the outer conductor cancels external fields, keeping the signal on the inner wire clean." },
    { "title": "Microwave oven door mesh", "scenario": "The door has a metal screen you can see through.", "how_the_math_applies": "The conducting mesh acts as a Gaussian shield: enclosed field is blocked, keeping microwaves in while letting light out." }
  ],
  "videos": {
    "concept_query": "Gauss's law electric flux explained conceptually",
    "math_query": "Gauss's law example problems sphere cylinder sheet",
    "combined_query": "Gauss's law calculus based physics worked examples flux"
  },
  "problems": [
    { "id": "p01", "difficulty": "easy", "prompt": "A uniform field $E = 500$ N/C passes perpendicular through a flat area $A = 2.0\\ \\text{m}^2$. Find the flux.", "correct_answer": "$1.0\\times10^{3}$ N·m$^2$/C", "solution_steps": ["$\\Phi = EA\\cos\\theta$ with $\\theta = 0$.", "$\\Phi = (500)(2.0)$", "$\\Phi = 1.0\\times10^{3}$ N·m$^2$/C"], "hint": "Perpendicular means $\\cos\\theta = 1$." },
    { "id": "p02", "difficulty": "easy", "prompt": "The same field $E = 500$ N/C and area $A = 2.0\\ \\text{m}^2$, but now the field makes $60^\\circ$ with the surface normal. Find the flux.", "correct_answer": "$500$ N·m$^2$/C", "solution_steps": ["$\\Phi = EA\\cos 60^\\circ$", "$\\Phi = (500)(2.0)(0.5)$", "$\\Phi = 500$ N·m$^2$/C"], "hint": "Use $\\cos 60^\\circ = 0.5$." },
    { "id": "p03", "difficulty": "easy", "prompt": "The net flux out of a closed surface is $1.13\\times10^{5}$ N·m$^2$/C. How much charge is enclosed?", "correct_answer": "$\\approx 1.0\\ \\mu\\text{C}$", "solution_steps": ["$Q_{enc} = \\varepsilon_0 \\Phi$", "$Q_{enc} = (8.85\\times10^{-12})(1.13\\times10^{5})$", "$Q_{enc} \\approx 1.0\\times10^{-6}$ C"], "hint": "Rearrange Gauss's law: $Q = \\varepsilon_0\\Phi$." },
    { "id": "p04", "difficulty": "medium", "prompt": "Find the field from an infinite sheet with surface charge density $\\sigma = 8.85\\times10^{-9}\\ \\text{C/m}^2$.", "correct_answer": "$500$ N/C", "solution_steps": ["$E = \\dfrac{\\sigma}{2\\varepsilon_0}$", "$E = \\dfrac{8.85\\times10^{-9}}{2(8.85\\times10^{-12})}$", "$E = 500$ N/C"], "hint": "Use the infinite-sheet result with the factor of 2." },
    { "id": "p05", "difficulty": "medium", "prompt": "Just outside a charged conductor the surface density is $\\sigma = 1.77\\times10^{-8}\\ \\text{C/m}^2$. Find the field there.", "correct_answer": "$2.0\\times10^{3}$ N/C", "solution_steps": ["Just outside a conductor: $E = \\dfrac{\\sigma}{\\varepsilon_0}$.", "$E = \\dfrac{1.77\\times10^{-8}}{8.85\\times10^{-12}}$", "$E = 2.0\\times10^{3}$ N/C"], "hint": "At a conductor's surface there is no factor of 2." },
    { "id": "p06", "difficulty": "medium", "prompt": "A charge of $5.0\\ \\mu\\text{C}$ is spread uniformly on a sphere. Find the field $0.20$ m outside its center.", "correct_answer": "$\\approx 1.1\\times10^{6}$ N/C", "solution_steps": ["Outside a spherical charge the field equals a point charge at the center.", "$E = k\\dfrac{Q}{r^2} = (8.99\\times10^9)\\dfrac{5.0\\times10^{-6}}{(0.20)^2}$", "$E \\approx 1.1\\times10^{6}$ N/C"], "hint": "Gauss's law makes the sphere look like a point charge from outside." },
    { "id": "p07", "difficulty": "medium", "prompt": "A charge sits inside a hollow metal sphere. What is the electric field within the metal itself (in equilibrium)?", "correct_answer": "Zero", "solution_steps": ["Inside a conductor in equilibrium, $\\vec{E} = 0$.", "A Gaussian surface inside the metal encloses no net charge, so the field is zero."], "hint": "Think about the field inside conducting material." },
    { "id": "p08", "difficulty": "hard", "prompt": "An infinite line carries $\\lambda = 3.0\\ \\mu\\text{C/m}$. Find the field $0.10$ m away.", "correct_answer": "$\\approx 5.4\\times10^{5}$ N/C", "solution_steps": ["$E = \\dfrac{2k\\lambda}{r}$", "$E = \\dfrac{2(8.99\\times10^9)(3.0\\times10^{-6})}{0.10}$", "$E \\approx 5.4\\times10^{5}$ N/C"], "hint": "Use a cylindrical Gaussian surface; the line-charge field falls off as $1/r$." },
    { "id": "p09", "difficulty": "hard", "prompt": "A point charge $q = 6.0$ nC sits at the center of a cube. Find the flux through one face.", "correct_answer": "$\\approx 113$ N·m$^2$/C", "solution_steps": ["Total flux: $\\Phi = q/\\varepsilon_0 = \\dfrac{6.0\\times10^{-9}}{8.85\\times10^{-12}} \\approx 678$ N·m$^2$/C.", "By symmetry each of the 6 faces gets an equal share.", "$\\Phi_{face} = 678/6 \\approx 113$ N·m$^2$/C."], "hint": "By symmetry the total flux splits equally among the six faces." },
    { "id": "p10", "difficulty": "stretch", "prompt": "Inside a closed surface are charges $+2\\ \\mu\\text{C}$, $+3\\ \\mu\\text{C}$, and $-1\\ \\mu\\text{C}$; a $+10\\ \\mu\\text{C}$ charge sits just outside. Find the net flux through the surface.", "correct_answer": "$\\approx 4.5\\times10^{5}$ N·m$^2$/C", "solution_steps": ["Only enclosed charge counts: $Q_{enc} = 2+3-1 = 4\\ \\mu\\text{C}$ (the outside $10\\ \\mu$C contributes zero).", "$\\Phi = Q_{enc}/\\varepsilon_0 = \\dfrac{4.0\\times10^{-6}}{8.85\\times10^{-12}}$", "$\\Phi \\approx 4.5\\times10^{5}$ N·m$^2$/C"], "hint": "External charges add no net flux — sum only the enclosed charge." }
  ]
}
