{
  "title": "Lenses, Interference & Diffraction",
  "summary": "Because light is a wave, it interferes and diffracts. Young's double slit gives bright fringes at $d\\sin\\theta = m\\lambda$ (spacing $y = m\\lambda L/d$); a single slit gives minima at $a\\sin\\theta = m\\lambda$; a diffraction grating sharpens the pattern with $d\\sin\\theta = m\\lambda$. (University Physics Vol. 3, Ch. 2–4.)",
  "concept_sections": [
    { "level": 1, "heading": "Converging and diverging lenses", "explanation": "A converging (convex) lens bends parallel rays to a focus; a diverging (concave) lens spreads them so they seem to come from a focus behind it. Ray tracing — a ray through the center goes straight, a parallel ray bends through the focus — locates the image, consistent with $1/f = 1/d_o + 1/d_i$." },
    { "level": 2, "heading": "Young's double slit", "explanation": "Light through two close slits overlaps and interferes, making bright and dark bands. Bright fringes occur where the path difference is a whole number of wavelengths: $d\\sin\\theta = m\\lambda$. On a screen a distance $L$ away, the bright fringes sit at $y = \\dfrac{m\\lambda L}{d}$ — proof that light is a wave." },
    { "level": 3, "heading": "Single-slit diffraction", "explanation": "Even one slit spreads light into a pattern, because waves from different parts of the slit interfere. The dark minima are at $a\\sin\\theta = m\\lambda$ (with $m = 1, 2, \\dots$), where $a$ is the slit width. Narrower slits spread light more." },
    { "level": 4, "heading": "Diffraction gratings", "explanation": "A grating has thousands of slits. The same condition $d\\sin\\theta = m\\lambda$ holds, but with so many slits the bright lines become very sharp and separated. Different wavelengths appear at different angles, spreading light into a spectrum — how we measure the composition of light." },
    { "level": 5, "heading": "Thin films and resolution", "explanation": "Interference also happens in thin films (soap bubbles, anti-reflective coatings), where reflections off the two surfaces combine. Diffraction also sets the ultimate limit on how finely any lens or telescope can resolve detail — smaller wavelengths and bigger apertures resolve more." }
  ],
  "real_world_examples": [
    { "title": "Colors on a CD or DVD", "scenario": "A disc throws rainbow colors in the light.", "how_the_math_applies": "The closely spaced tracks act as a reflection grating; $d\\sin\\theta = m\\lambda$ sends each color to a different angle, splitting white light into a spectrum." },
    { "title": "Anti-reflective coating", "scenario": "Camera and glasses lenses have a faint colored sheen.", "how_the_math_applies": "A thin coating makes reflections off its two surfaces interfere destructively, cancelling glare for the targeted wavelength." },
    { "title": "Telescope resolution", "scenario": "Bigger telescopes see finer detail.", "how_the_math_applies": "Diffraction blurs points by an amount set by wavelength over aperture; a larger aperture $D$ shrinks the blur, resolving closer stars." }
  ],
  "videos": {
    "concept_query": "double slit interference single slit diffraction explained",
    "math_query": "Young double slit diffraction grating fringe spacing example problems",
    "combined_query": "interference and diffraction calculus based physics worked examples"
  },
  "problems": [
    { "id": "p01", "difficulty": "easy", "prompt": "Double slit: $d = 0.10$ mm, $\\lambda = 500$ nm, screen $L = 2.0$ m away. Find the distance to the first bright fringe ($m=1$).", "correct_answer": "$0.010$ m (1.0 cm)", "solution_steps": ["$y = \\dfrac{m\\lambda L}{d}$", "$y = \\dfrac{(1)(500\\times10^{-9})(2.0)}{1.0\\times10^{-4}}$", "$y = 0.010$ m"], "hint": "Use $y = m\\lambda L/d$; keep everything in meters." },
    { "id": "p02", "difficulty": "easy", "prompt": "A grating has $500$ lines/mm. Find the slit spacing $d$.", "correct_answer": "$2.0\\times10^{-6}$ m", "solution_steps": ["$d = \\dfrac{1}{500\\ \\text{lines/mm}} = \\dfrac{1}{5.0\\times10^{5}\\ \\text{lines/m}}$", "$d = 2.0\\times10^{-6}$ m"], "hint": "Convert lines/mm to lines/m, then take the reciprocal." },
    { "id": "p03", "difficulty": "easy", "prompt": "Single slit of width $a = 0.020$ mm, $\\lambda = 500$ nm. Find the angle to the first minimum.", "correct_answer": "$\\approx 1.4^\\circ$", "solution_steps": ["$a\\sin\\theta = m\\lambda$, $m=1$: $\\sin\\theta = \\lambda/a = \\dfrac{500\\times10^{-9}}{2.0\\times10^{-5}} = 0.025$", "$\\theta \\approx 1.4^\\circ$"], "hint": "First minimum: $\\sin\\theta = \\lambda/a$." },
    { "id": "p04", "difficulty": "medium", "prompt": "In a double-slit setup the first bright fringe is $1.0$ cm from center on a screen $2.0$ m away, with $d = 0.10$ mm. Find the wavelength.", "correct_answer": "$500$ nm", "solution_steps": ["$\\lambda = \\dfrac{y d}{m L} = \\dfrac{(0.010)(1.0\\times10^{-4})}{(1)(2.0)}$", "$\\lambda = 5.0\\times10^{-7}$ m $= 500$ nm"], "hint": "Rearrange $y = m\\lambda L/d$ for $\\lambda$." },
    { "id": "p05", "difficulty": "medium", "prompt": "A grating with $d = 2.0\\times10^{-6}$ m is lit by $\\lambda = 600$ nm. Find the angle of the second-order ($m=2$) bright line.", "correct_answer": "$\\approx 36.9^\\circ$", "solution_steps": ["$\\sin\\theta = \\dfrac{m\\lambda}{d} = \\dfrac{2(600\\times10^{-9})}{2.0\\times10^{-6}} = 0.6$", "$\\theta \\approx 36.9^\\circ$"], "hint": "Use $d\\sin\\theta = m\\lambda$ with $m = 2$." },
    { "id": "p06", "difficulty": "medium", "prompt": "For the double slit of problem 1 ($d = 0.10$ mm, $\\lambda = 500$ nm, $L = 2.0$ m), find the distance to the third bright fringe.", "correct_answer": "$0.030$ m (3.0 cm)", "solution_steps": ["$y = \\dfrac{m\\lambda L}{d}$ with $m = 3$.", "$y = 3(0.010\\ \\text{m})$", "$y = 0.030$ m"], "hint": "Fringe position scales with $m$." },
    { "id": "p07", "difficulty": "medium", "prompt": "Find the fringe spacing $\\Delta y$ for $\\lambda = 600$ nm, $L = 1.5$ m, slit separation $d = 0.20$ mm.", "correct_answer": "$4.5\\times10^{-3}$ m (4.5 mm)", "solution_steps": ["$\\Delta y = \\dfrac{\\lambda L}{d}$", "$\\Delta y = \\dfrac{(600\\times10^{-9})(1.5)}{2.0\\times10^{-4}}$", "$\\Delta y = 4.5\\times10^{-3}$ m"], "hint": "Adjacent fringes are separated by $\\lambda L/d$." },
    { "id": "p08", "difficulty": "hard", "prompt": "A single slit produces its first minimum at $\\theta = 2.0^\\circ$ with $\\lambda = 500$ nm. Find the slit width.", "correct_answer": "$\\approx 1.4\\times10^{-5}$ m", "solution_steps": ["$a = \\dfrac{\\lambda}{\\sin\\theta} = \\dfrac{500\\times10^{-9}}{\\sin 2.0^\\circ}$", "$\\sin 2.0^\\circ \\approx 0.0349$", "$a \\approx 1.4\\times10^{-5}$ m"], "hint": "Solve $a\\sin\\theta = \\lambda$ for $a$." },
    { "id": "p09", "difficulty": "stretch", "prompt": "A grating with $d = 2.0\\times10^{-6}$ m is lit by $\\lambda = 600$ nm. What is the highest order $m$ that can appear?", "correct_answer": "$m = 3$", "solution_steps": ["Maximum when $\\sin\\theta = 1$: $m_{max} = d/\\lambda = \\dfrac{2.0\\times10^{-6}}{600\\times10^{-9}} = 3.33$.", "Orders must be whole numbers $\\le 3.33$.", "So the highest order is $m = 3$."], "hint": "Set $\\sin\\theta = 1$ in $d\\sin\\theta = m\\lambda$ and round down." }
  ]
}
