{
  "title": "Maxwell's Equations, EM Waves & Polarization",
  "summary": "Maxwell's four equations unify electricity and magnetism and predict electromagnetic waves traveling at $c = 1/\\sqrt{\\mu_0\\varepsilon_0} = 3\\times10^8$ m/s, with $c = f\\lambda$ and $E/B = c$. Light is such a wave; polarizers filter it by Malus's law $I = I_0\\cos^2\\theta$. (University Physics Vol. 2, Ch. 16.)",
  "glossary": {
    "Maxwell's equations": {
      "plain": "The four laws that tie together all electricity and magnetism.",
      "in_class": "Gauss (×2), Faraday, and Ampère–Maxwell; together they predict light."
    },
    "electromagnetic wave": {
      "plain": "A self-sustaining wave of electric and magnetic fields traveling through space.",
      "in_class": "$\\vec E$ and $\\vec B$ are perpendicular to each other and to the travel direction."
    },
    "displacement current": {
      "plain": "A changing electric field acting like a current that makes magnetic field.",
      "in_class": "Maxwell's addition to Ampère's law; makes EM waves possible."
    },
    "Poynting vector": {
      "plain": "Points which way an EM wave carries energy, and how much.",
      "in_class": "$\\vec S = \\dfrac{1}{\\mu_0}\\vec E \\times \\vec B$; its average is the intensity."
    },
    "intensity": {
      "plain": "The power an EM wave delivers per unit area.",
      "in_class": "$I = \\dfrac{P}{A}$, related to the average Poynting vector."
    },
    "polarization": {
      "plain": "The direction the electric field of a wave points.",
      "in_class": "A polarizer passes one direction; Malus's law $I = I_0\\cos^2\\theta$."
    },
    "speed of light": {
      "plain": "How fast electromagnetic waves travel in a vacuum.",
      "in_class": "$c = \\dfrac{1}{\\sqrt{\\mu_0\\varepsilon_0}} \\approx 3\\times10^8$ m/s."
    }
  },
  "concept_sections": [
    {
      "level": 1,
      "heading": "Maxwell's synthesis",
      "explanation": "Maxwell's four equations gather all of electromagnetism: Gauss's law (charges make $E$ fields), its magnetic version (no magnetic monopoles), Faraday's law (changing $B$ makes $E$), and Ampère–Maxwell (currents and changing $E$ make $B$). Maxwell's new 'displacement current' term made the set consistent."
    },
    {
      "level": 2,
      "heading": "Electromagnetic waves",
      "explanation": "A changing electric field makes a magnetic field and vice versa, so the two can sustain each other and travel as a wave — with no medium needed. The fields are perpendicular to each other and to the direction of travel (a transverse wave)."
    },
    {
      "level": 3,
      "heading": "The speed of light",
      "explanation": "The theory fixes the speed: $c = \\dfrac{1}{\\sqrt{\\mu_0\\varepsilon_0}} = 3.0\\times10^8$ m/s. All EM waves obey $c = f\\lambda$, and the field magnitudes are locked together by $\\dfrac{E}{B} = c$. Radio, microwaves, light, and X-rays differ only in frequency."
    },
    {
      "level": 4,
      "heading": "Energy and the spectrum",
      "explanation": "EM waves carry energy; their intensity depends on the square of the field amplitude, and they even exert a small radiation pressure. Ordering by frequency gives the electromagnetic spectrum: radio → microwave → infrared → visible → ultraviolet → X-ray → gamma."
    },
    {
      "level": 5,
      "heading": "Polarization and Malus's law",
      "explanation": "Light's electric field can point in a definite direction — that's polarization. A polarizer passes only the aligned component. If already-polarized light hits a polarizer at angle $\\theta$, the transmitted intensity is $I = I_0\\cos^2\\theta$ (Malus's law). Unpolarized light loses half its intensity through the first polarizer."
    }
  ],
  "real_world_examples": [
    {
      "title": "The electromagnetic spectrum",
      "scenario": "Wi-Fi, visible light, and X-rays are all 'the same thing.'",
      "how_the_math_applies": "All obey $c = f\\lambda$; only the frequency differs. Wi-Fi is ~$5\\times10^9$ Hz, visible light ~$5\\times10^{14}$ Hz — same wave, different $f$."
    },
    {
      "title": "Polarized sunglasses",
      "scenario": "Polarized lenses cut glare off water and roads.",
      "how_the_math_applies": "Glare is horizontally polarized; a vertical polarizer blocks it. Malus's law $I = I_0\\cos^2\\theta$ gives how much passes at each angle."
    },
    {
      "title": "LCD screens",
      "scenario": "Your monitor uses polarizers you can't see.",
      "how_the_math_applies": "Liquid crystals rotate light's polarization; crossed polarizers then turn each pixel bright or dark via $I = I_0\\cos^2\\theta$."
    }
  ],
  "videos": {
    "concept_query": "Maxwell's equations electromagnetic waves explained",
    "math_query": "electromagnetic waves speed of light Malus law polarization example problems",
    "combined_query": "electromagnetic waves polarization calculus based physics worked examples"
  },
  "problems": [
    {
      "id": "p01",
      "difficulty": "easy",
      "prompt": "An FM station broadcasts at $f = 100$ MHz. Find the wavelength.",
      "correct_answer": "$3.0$ m",
      "solution_steps": [
        "$c = f\\lambda \\Rightarrow \\lambda = c/f$",
        "$\\lambda = \\dfrac{3.0\\times10^8}{1.0\\times10^8}$",
        "$\\lambda = 3.0$ m"
      ],
      "hint": "Use $\\lambda = c/f$ with $c = 3\\times10^8$ m/s."
    },
    {
      "id": "p02",
      "difficulty": "easy",
      "prompt": "In an EM wave the electric field amplitude is $E = 300$ V/m. Find the magnetic field amplitude.",
      "correct_answer": "$1.0\\times10^{-6}$ T",
      "solution_steps": [
        "$B = E/c$",
        "$B = \\dfrac{300}{3.0\\times10^8}$",
        "$B = 1.0\\times10^{-6}$ T"
      ],
      "hint": "The fields obey $E/B = c$."
    },
    {
      "id": "p03",
      "difficulty": "easy",
      "prompt": "Light from the Sun ($1.5\\times10^{11}$ m away) takes how long to reach Earth?",
      "correct_answer": "$500$ s (≈ 8.3 min)",
      "solution_steps": [
        "$t = d/c$",
        "$t = \\dfrac{1.5\\times10^{11}}{3.0\\times10^8}$",
        "$t = 500$ s"
      ],
      "hint": "Time is distance over speed, with $c = 3\\times10^8$ m/s."
    },
    {
      "id": "p04",
      "difficulty": "medium",
      "prompt": "Polarized light of intensity $I_0$ passes through a polarizer whose axis is $60^\\circ$ from the light's polarization. Find the transmitted intensity.",
      "correct_answer": "$0.25\\,I_0$",
      "solution_steps": [
        "Malus's law: $I = I_0\\cos^2\\theta$",
        "$I = I_0\\cos^2 60^\\circ = I_0(0.5)^2$",
        "$I = 0.25\\,I_0$"
      ],
      "hint": "Apply $I = I_0\\cos^2\\theta$ with $\\cos 60^\\circ = 0.5$."
    },
    {
      "id": "p05",
      "difficulty": "medium",
      "prompt": "Green light has wavelength $\\lambda = 500$ nm. Find its frequency.",
      "correct_answer": "$6.0\\times10^{14}$ Hz",
      "solution_steps": [
        "$f = c/\\lambda$",
        "$f = \\dfrac{3.0\\times10^8}{500\\times10^{-9}}$",
        "$f = 6.0\\times10^{14}$ Hz"
      ],
      "hint": "$f = c/\\lambda$; keep wavelength in meters."
    },
    {
      "id": "p06",
      "difficulty": "medium",
      "prompt": "Unpolarized light of intensity $I_0$ passes through a polarizer, then a second polarizer at $30^\\circ$ to the first. Find the final intensity.",
      "correct_answer": "$0.375\\,I_0$",
      "solution_steps": [
        "First polarizer halves it: $I_1 = 0.5\\,I_0$.",
        "Second (Malus): $I_2 = I_1\\cos^2 30^\\circ = 0.5\\,I_0(0.866)^2$",
        "$I_2 = 0.5\\,I_0(0.75) = 0.375\\,I_0$"
      ],
      "hint": "First polarizer gives $I_0/2$; then apply Malus's law."
    },
    {
      "id": "p07",
      "difficulty": "medium",
      "prompt": "A microwave oven works at $f = 2.45$ GHz. Find the wavelength.",
      "correct_answer": "$\\approx 0.122$ m",
      "solution_steps": [
        "$\\lambda = c/f$",
        "$\\lambda = \\dfrac{3.0\\times10^8}{2.45\\times10^9}$",
        "$\\lambda \\approx 0.122$ m"
      ],
      "hint": "Use $\\lambda = c/f$ with $f$ in Hz."
    },
    {
      "id": "p08",
      "difficulty": "hard",
      "prompt": "Polarized light passes through a polarizer and comes out at half its original intensity. What is the angle between the light and the polarizer axis?",
      "correct_answer": "$45^\\circ$",
      "solution_steps": [
        "$I = I_0\\cos^2\\theta = 0.5\\,I_0 \\Rightarrow \\cos^2\\theta = 0.5$.",
        "$\\cos\\theta = 0.707$",
        "$\\theta = 45^\\circ$"
      ],
      "hint": "Solve $\\cos^2\\theta = 0.5$."
    },
    {
      "id": "p09",
      "difficulty": "stretch",
      "prompt": "Unpolarized light passes through three polarizers oriented at $0^\\circ$, $45^\\circ$, and $90^\\circ$. Find the final intensity as a fraction of $I_0$.",
      "correct_answer": "$0.125\\,I_0$",
      "solution_steps": [
        "After 1st: $I_1 = 0.5\\,I_0$.",
        "After 2nd ($45^\\circ$): $I_2 = I_1\\cos^2 45^\\circ = 0.5\\,I_0(0.5) = 0.25\\,I_0$.",
        "After 3rd ($45^\\circ$ from 2nd): $I_3 = I_2\\cos^2 45^\\circ = 0.25\\,I_0(0.5) = 0.125\\,I_0$."
      ],
      "hint": "Apply Malus's law across each successive $45^\\circ$ step; the middle polarizer lets light through the crossed pair."
    }
  ]
}
